{
  "schema_version": "1.0",
  "id": "kv.mechanics.hero_creation.travelling_gear",
  "type": "rule_card",
  "title": "Походное снаряжение",
  "source": {
    "book": "kv_core",
    "edition": "02_03_2026_с_рубрикатором",
    "section": "искатели приключений → СТАРТОВОЕ СНАРЯЖЕНИЕ → Походное снаряжение",
    "pages": [
      49
    ]
  },
  "verified": false,
  "locale": "ru",
  "terminology": "pandora_box",
  "notes": "",
  "payload": {
    "subsystem": "hero_creation",
    "title": "Походное снаряжение",
    "source_text": [
      "Походное снаряжение героя — это вещи, которые искатели приключений берут с собой, помимо оружия и доспехов. Зимой в него входят сапоги и тёплая, толстая одежда — куртка, плащ на меху, шерстяные штаны и одеяла. В тёплое время года герой может обойтись без самых тяжёлых вещей, ограничившись лёгкой одеждой и плащом. Походное снаряжение не обязательно подробно указывать в бланке героя, если только игрок сам этого не захочет, и оно не имеет рейтинга Нагрузки."
    ],
    "summary": "Походное снаряжение — это всё, кроме оружия и доспехов: зимой сапоги и тёплая одежда, летом лёгкая одежда и плащ. Его не обязательно подробно вписывать в бланк, и оно не имеет рейтинга Нагрузки.",
    "parameters": {
      "has_load": false
    },
    "related": [
      "kv.mechanics.hero_creation.starting_equipment"
    ]
  }
}
