{
  "schema_version": "1.0",
  "id": "kv.mechanics.solo.zadaniya_pokrovitelya",
  "type": "rule_card",
  "title": "Задания покровителя",
  "source": {
    "book": "igra_dlya_odnogo",
    "edition": "на_рассылку_03_04_2026",
    "section": "ваш искатель приключений",
    "pages": [
      7
    ]
  },
  "verified": false,
  "locale": "ru",
  "terminology": "pandora_box",
  "notes": "",
  "payload": {
    "subsystem": "solo",
    "title": "Задания покровителя",
    "source_text": [
      "В приведённых далее таблицах для каждого стартового покровителя имеется набор заданий, отражающих его задачи. Используйте их, чтобы придумать подробное задание от покровителя в начале приключения вашего героя или следующую цель продолжающейся кампании. Выбирая задание покровителя, можно взять наиболее интересное вам, либо определить его случайным образом, бросив Кость успеха, либо же выполнять задания по порядку, начиная с первого. Представьте, как покровитель раскрывает детали поручения, подумайте над вопросами, которые могут возникнуть у героя в связи с заданием. Если предстоит путешествие, определите пункт назначения. Если вам и покровителю он неизвестен, решите, что нужно сделать, чтобы найти цель задания. Задавая покровителю вопросы о задании, можно просто вообразить его ответы в духе самой задачи или использовать таблицу ответов и таблицу преданий, чтобы придумать ответ. Оставьте место для появления деталей в задании, пока неизвестных вам и покровителю."
    ],
    "summary": "Как пользоваться таблицами заданий покровителя: взять задание по интересу, выбрать случайно (Кость успеха) или выполнять по порядку; уточнять детали поручения через таблицы ответов и преданий, оставляя место для ещё неизвестных деталей. Сами таблицы заданий — kv.solo.patron_tasks.*.",
    "parameters": {
      "oracle_refs": [
        "kv.solo.answers",
        "kv.solo.lore",
        "kv.solo.patron_tasks.balin",
        "kv.solo.patron_tasks.bilbo",
        "kv.solo.patron_tasks.cirdan",
        "kv.solo.patron_tasks.gandalf",
        "kv.solo.patron_tasks.gilraen",
        "kv.solo.patron_tasks.tom_and_goldberry"
      ]
    },
    "related": []
  }
}
