{
  "schema_version": "1.0",
  "id": "kv.mechanics.equipment.bronya_i_schity",
  "type": "rule_card",
  "title": "Броня и щиты",
  "source": {
    "book": "kv_core",
    "edition": "02_03_2026_с_рубрикатором",
    "section": "отличия → БОЕВОЕ СНАРЯЖЕНИЕ → Броня и щиты",
    "pages": [
      75,
      76
    ]
  },
  "verified": false,
  "locale": "ru",
  "terminology": "pandora_box",
  "notes": "Описания (без чисел); числа Защита/Нагрузка/Парирование — combat_gear (B2.2).",
  "payload": {
    "subsystem": "equipment",
    "title": "Броня и щиты",
    "source_text": [
      "Доспехи и щиты — важнейшее снаряжение любого воина. Их уровень защиты, вес и красота зависят от выбранного материала и искусности мастера. Недавно созданный герой начинает с одним доспехом и может взять щит и шлем. КОЖАНЫЙ ДОСПЕХ Самый простой из существующих доспехов; представляет собой сшитые слои выделанной варёной звериной кожи. Отлично подходит для охоты или путешествий, так как он лёгкий и удобный — особенно по сравнению с кольчугой. Кожаный доспех может изготавливаться в виде рубахи или облегающего корслета с длинными рукавами, который закрывает бёдра владельца. КОЛЬЧУЖНЫЙ ДОСПЕХ Кольчуга — наилучший тип брони в Средиземье в конце Третьей эпохи. Такие доспехи из плотно пригнанных металлических колец предназначены для защиты от рубящих и колющих ударов. Кольчужная броня может быть очень разной — от сияющих хауберков эльфийских владык до чёрных кольчуг вождей орков. Древняя кольчуга гномьей работы — редкая находка, несравненная и бесценная вещь. Кольчужная рубаха защищает спину, грудь и живот владельца, а кольчужный хауберк — это рубаха с длинными рукавами. ШЛЕМ Шлемы, носимые в бою и на церемониях, обычно делают из кожи или железа, реже из драгоценных металлов. Их формы и украшения отличаются и зачастую помогают определить носителя или его принадлежность к определённому народу, поскольку защитные элементы шлема, такие как наносник или нащёчники, нередко закрывают лицо, делая воина неузнаваемым. ЩИТЫ Доспехи часто оказываются неэффективны против самого тяжёлого оружия вроде молотов или других тупых орудий войны, поэтому многие воины используют щиты для отражения ударов. Как правило, щиты делают из дерева, обтянутого кожей и укреплённого металлом; их формы и назначения различаются. БАКЛЕРЫ. Круглые деревянные щиты с выступающим металлическим умбоном, часто меньше и легче обычных щитов. БОЛЬШИЕ ЩИТЫ. Каплевидные, круглые или бочкообразные щиты, которые носят лишь самые крепкие воины — и на которых их тела приносят с поля боя, если они падут. Некоторые считают такие щиты слишком громоздкими и неудобными. ЩИТЫ. Круглые и овальные щиты делаются из нескольких слоёв дерева и обычно укрепляются большим железным умбоном в центре, зачастую с гравировкой или другим украшением. Обычный щит хорошо защищает от стрел и особенно полезен в ближнем бою."
    ],
    "summary": "Описания доспехов и щитов: герой начинает с одним доспехом и может взять щит и шлем. Кожаный доспех (рубаха или корслет), кольчужный доспех (рубаха или хауберк), шлем; щиты — баклеры, большие щиты и обычные щиты. Числовые характеристики (Защита, Нагрузка, модиф. Парирования) — в таблице combat_gear.",
    "parameters": {
      "armour_types": [
        "leather_shirt",
        "leather_corslet",
        "short_mail",
        "mail",
        "helm"
      ],
      "shield_types": [
        "buckler",
        "shield",
        "great_shield"
      ],
      "stats_in": "kv.mechanics.hero_creation.combat_gear"
    },
    "related": [
      "kv.mechanics.equipment.boevoe_snaryazhenie",
      "kv.mechanics.hero_creation.combat_gear"
    ]
  }
}
