{
  "schema_version": "1.0",
  "id": "kv.mechanics.fellowship_phase.kak_ustroena_faza_bratstva",
  "type": "rule_card",
  "title": "Как устроена Фаза братства",
  "source": {
    "book": "kv_core",
    "edition": "02_03_2026_с_рубрикатором",
    "section": "ФАЗА БРАТСТВА → Как устроена Фаза братства",
    "pages": [
      118
    ]
  },
  "verified": false,
  "locale": "ru",
  "terminology": "pandora_box",
  "notes": "",
  "payload": {
    "subsystem": "fellowship_phase",
    "title": "Как устроена Фаза братства",
    "source_text": [
      "В этом гостеприимном доме они пробыли долго, не меньше четырнадцати дней, и им было нелегко его покидать. Фаза братства — это часть игры, в которой управление переходит к игрокам. Если в Фазе приключений они лишь реагируют на описываемые хранителем сюжетные ходы, то в Фазе братства сами развивают повествование с учётом стремлений своих героев и контролируют сюжет. В этой части игры хранителю следует отпустить бразды правления и наблюдать со стороны за тем, чем будут заниматься герои игроков. Желательно, чтобы игроки подробно и красочно описывали то, что делают их герои в Фазе братства, не ограничиваясь теми занятиями, которые оказывают непосредственные игровые эффекты. Например, искатели приключений могут расспросить персонажей хранителя о каких-то зацепках, проблемах и возможностях, появившихся в результате предыдущей Фазы приключений. При этом игроки не должны забывать о продолжительности Фазы братства и о том, что она ограничена определённой территорией. Также им не разрешается вводить в игру новые обстоятельства — например, отправлять своих героев туда, где они ещё не бывали, или знакомить их с теми, кого они ещё не встречали (то есть заниматься тем, что больше подходит для Фазы приключений). Фаза братства завершает каждую Фазу приключений и в идеале проходит в конце игровой сессии. Впрочем, она может также открывать новую сессию или предшествовать новой Фазе приключений."
    ],
    "summary": "В Фазе братства управление переходит к игрокам: они сами развивают повествование с учётом стремлений героев, а хранитель наблюдает. Фаза ограничена временем и территорией; нельзя вводить новые места или незнакомых персонажей (это для Фазы приключений). Фаза братства завершает каждую Фазу приключений.",
    "parameters": {
      "narrative_control": "players",
      "constraints": [
        "limited_duration",
        "limited_territory",
        "no_new_places_or_npcs"
      ],
      "ends_each_adventuring_phase": true
    },
    "related": [
      "kv.mechanics.fellowship_phase.struktura_fazy_bratstva"
    ]
  }
}
