{
  "schema_version": "1.0",
  "id": "kv.mechanics.keeper_tools.sessii_fazy_priklyucheniy",
  "type": "rule_card",
  "title": "Сессии Фазы приключений",
  "source": {
    "book": "kv_core",
    "edition": "02_03_2026_с_рубрикатором",
    "section": "Фаза приключений → Сессии Фазы приключений",
    "pages": [
      92,
      93
    ]
  },
  "verified": false,
  "locale": "ru",
  "terminology": "pandora_box",
  "notes": "",
  "payload": {
    "subsystem": "keeper_tools",
    "title": "Сессии Фазы приключений",
    "source_text": [
      "В среднем Фаза приключений длится две-три игровые сессии, каждая из которых занимает примерно 3 часа. Как правило, любая игровая сессия строится по одной и той же схеме: 1. Вступление. 2. Сцены. 3. Конец сессии. ВСТУПЛЕНИЕ Каждая сессия начинается с того, что хранитель знакомит игроков с текущей ситуацией. Обычно указываются дата или время года (когда), место действия (где) и определяется вводная ситуация (что), включая сведения, обосновывающие участие отряда (почему). Если это первая игровая сессия Фазы приключений, хранитель использует все перечисленные выше элементы для построения начальной сцены. Если же сессия уже не первая, начальная сцена продолжается с того места, где Фаза приключений прервалась в конце предыдущей сессии. Снова задаётся дата, выбирается место и сообщаются текущие обстоятельства. 1 ФАЗА ПРИКЛЮЧЕНИЙ 93 СЦЕНЫ После начала сессии игровой процесс движется от одной сцены к другой. В каждой сцене возникает ситуация, в которой игрокам нужно принимать значимые решения. Для связности повествования хранителю стоит описывать каждую сцену с учётом последствий предыдущей и выборов, сделанных игроками («Хранитель», стр. 128). Длительность каждой сцены может разниться: сцена может занимать меньше часа (короткая, но значимая встреча) или же всю сессию целиком (Совет, для которого требуется несколько часов игрового времени). С учётом основных и второстепенных сцен игровая сессия не должна занимать более трёхчетырёх часов. КОНЕЦ СЕССИИ Когда отведённое на игровую сессию время истекает, перед хранителем и игроками встают два возможных варианта развития ситуации, в зависимости от того, достиг отряд финала сюжетной линии с участием героев, или же для её завершения требуется больше времени. Если сессия заканчивается, а игроки не добились подходящей развязки, игра должна продолжиться позже, в новой сессии той же Фазы приключений. Когда играющие соберутся вновь, хранитель должен начать новую игровую сессию с краткого изложения событий предыдущей сессии. Если же текущая сюжетная линия была завершена, хранитель ставит точку в игровой сессии. Фаза приключений заканчивается, а сессия продолжается Фазой братства, либо же Фаза братства назначается на начало следующей сессии, в зависимости от времени, оставшегося на игру (глава 7 «Фаза братства»)."
    ],
    "summary": "Фаза приключений в среднем занимает две-три сессии по ~3 часа. Сессия строится по схеме: 1) вступление (когда/где/что/почему), 2) сцены, 3) конец сессии. Сцена может длиться от менее часа до целой сессии (Совет). Если сюжетная линия не завершена — продолжение в новой сессии; если завершена — далее Фаза братства.",
    "parameters": {
      "sessions_per_phase": "two_to_three",
      "session_hours": "about_3",
      "session_structure": [
        "intro",
        "scenes",
        "session_end"
      ],
      "max_session_hours": "three_to_four"
    },
    "related": [
      "kv.mechanics.keeper_tools.kak_ustroena_faza_priklyucheniy",
      "kv.mechanics.council.sovet"
    ]
  }
}
