{
  "schema_version": "1.0",
  "id": "kv.mechanics.solo.manevrennaya_poziciya_dalniy_boy",
  "type": "rule_card",
  "title": "Манёвренная позиция (дальний бой)",
  "source": {
    "book": "igra_dlya_odnogo",
    "edition": "на_рассылку_03_04_2026",
    "section": "сражение",
    "pages": [
      17
    ]
  },
  "verified": false,
  "locale": "ru",
  "terminology": "pandora_box",
  "notes": "",
  "payload": {
    "subsystem": "solo",
    "title": "Манёвренная позиция (дальний бой)",
    "source_text": [
      "Герой сражается на ходу, двигаясь по местности и обстреливая преследующих или убегающих врагов. ♦ Герой может атаковать противников только оружием дальнего боя. При бросках за противников, атакующих героя оружием ближнего боя, убирается 1к, а за атакующих оружием дальнего боя штрафа нет. ♦ При проверках атак дальнего боя героя убирается 1к. ♦ Чтобы герой покинул бой, совершите проверку атаки дальнего боя (не убирая 1к). При успехе герой не наносит урон, а покидает поле боя, в противном случае он остаётся в бою. ♦ Боевая задача: Продвинуться."
    ],
    "summary": "Механика манёвренной позиции: герой атакует только дальним оружием; врагам ближнего боя −1к, дальнего — без штрафа; атакам героя −1к; выход из боя — проверкой дальней атаки без −1к (при успехе уходит без урона); доступна боевая задача Продвинуться.",
    "parameters": {},
    "related": [
      "kv.mechanics.combat.sovershenie_atak",
      "kv.mechanics.combat.vyhod_iz_boya"
    ]
  }
}
