{
  "schema_version": "1.0",
  "id": "kv.mechanics.equipment.oruzhie",
  "type": "rule_card",
  "title": "Оружие",
  "source": {
    "book": "kv_core",
    "edition": "02_03_2026_с_рубрикатором",
    "section": "отличия → БОЕВОЕ СНАРЯЖЕНИЕ → Оружие",
    "pages": [
      73,
      75
    ]
  },
  "verified": false,
  "locale": "ru",
  "terminology": "pandora_box",
  "notes": "Описания (без чисел); числа Урон/Травма/Нагрузка/Боевое умение — combat_gear (B2.2).",
  "payload": {
    "subsystem": "equipment",
    "title": "Оружие",
    "source_text": [
      "Далее приведены красочные описания каждого типа оружия, доступного героям, только начинающим свой путь в Средиземье. ДВУРУЧНЫЙ ТОПОР Двуручный топор — это впечатляющее оружие, которое можно удержать лишь двумя руками. Он может проломить доспех, как дубина, а может рассечь его, как меч. ДЛИННОЕ КОПЬЁ Из-за более длинного древка, чем у других копий, длинное копьё нельзя метать; держать его можно только двумя руками. ДЛИННЫЙ ЛУК Таким луком — в рост человека и значительно мощнее обычного — может владеть лишь воин, рост и телосложение которого позволяют полностью натянуть тетиву. Пущенная из этого лука стрела может пробить самый прочный доспех. ДЛИННЫЙ МЕЧ Только искуснейшие кузнецы умеют ковать длинные мечи. Острые клинки людей Запада, созданные из редких металлов, прекрасное оружие эльфов и гномов часто называют ГЛАВА 4 74 длинными мечами. Их можно держать одной рукой или перехватить двумя для мощных рубящих ударов. ДУБИНА Дубина, вероятно, самое простое оружие. Это может быть грубый тяжёлый кусок дерева, опасный инструмент, окованный железом, или посох с искусной резьбой, также показывающий статус владельца. ЖЕЗЛ Жезлом считается любое ударное одноручное орудие — вроде небольшой палицы или короткого посоха. КИНЖАЛ Одноручным клинкам найдётся множество применений — от снятия шкуры с животных до решения споров между бандитами. Ножи и кинжалы встречаются повсеместно, и в глуши невозможно встретить кого-либо без подобного оружия на поясе. КИРКА Тяжёлый горный инструмент с изогнутым наконечником, представляющим собой шип с одной стороны и мотыжное лезвие с другой. Те гномы, что следовали за Даином Железностопом в Битве Пяти воинств, пользовались кирками в бою с устрашающими результатами. КОПЬЁ Пожалуй, самое универсальное оружие — это копьё: его можно метать или сражаться им, держа одной или двумя руками. КОРОТКИЙ МЕЧ Длинные кинжалы и ножи, а также короткие мечи, предназначенные для ближнего боя. КОРОТКОЕ КОПЬЁ Копьё длиной около 1,8 метра, которое можно метать как дротик или ловко колоть им врага одной рукой. ЛУК Простой боевой лук, почти не отличимый от обычного охотничьего лука. Длиной он не более полутора метров, чтобы можно было быстрее натягивать тетиву. МЕЧ Одноручный обоюдоострый меч с прямым лезвием, которым рубят или делают колющие выпады. Наиболее распространённый вид меча. ОТЛИЧИЯ 75 СЕКИРА Секиру держат одной или двумя руками и прорубают ей даже прочнейшую броню. Секира сложна в обращении, но в руках мастера становится страшным оружием. Умелый воин умеет сражаться как лезвием, так и длинным древком. ТОПОР Боевая версия обычного топора для рубки дров встречается на поясе у многих путешественников, выросших в лесу или близ него."
    ],
    "summary": "Красочные описания каждого типа оружия, доступного начинающим героям (двуручный топор, длинное копьё, длинный лук, длинный меч, дубина, жезл, кинжал, кирка, копьё, короткий меч, короткое копьё, лук, меч, секира, топор). Числовые характеристики — в таблице combat_gear.",
    "parameters": {
      "weapon_types": [
        "unarmed",
        "dagger",
        "rod",
        "club",
        "short_sword",
        "sword",
        "long_sword",
        "short_spear",
        "spear",
        "long_spear",
        "axe",
        "battle_axe",
        "great_axe",
        "mattock",
        "bow",
        "long_bow"
      ],
      "stats_in": "kv.mechanics.hero_creation.combat_gear"
    },
    "related": [
      "kv.mechanics.equipment.boevoe_snaryazhenie",
      "kv.mechanics.hero_creation.combat_gear",
      "kv.mechanics.traits.spisok_boevyh_umeniy"
    ]
  }
}
