{
  "schema_version": "1.0",
  "id": "kv.mechanics.hero_creation.ponies_and_horses",
  "type": "rule_card",
  "title": "Пони хоббитов и лошади",
  "source": {
    "book": "kv_core",
    "edition": "02_03_2026_с_рубрикатором",
    "section": "искатели приключений → СТАРТОВОЕ СНАРЯЖЕНИЕ → Пони хоббитов и лошади",
    "pages": [
      50,
      51
    ]
  },
  "verified": false,
  "locale": "ru",
  "terminology": "pandora_box",
  "notes": "Изнурение в пути и скорость скакунов — B5 (journey, стр. 108).",
  "payload": {
    "subsystem": "hero_creation",
    "title": "Пони хоббитов и лошади",
    "source_text": [
      "Общая Нагрузка героя не может превышать его рейтинга Выносливости. Так как именно рейтинг Выносливости определяет, когда герой начинает уставать, в целом разумно держать общую Нагрузку значительно ниже максимально допустимой («Выносливость», стр. 69). Игрок заносит рейтинг Нагрузки своего героя на бланк героя и должен обновлять его, если этот рейтинг меняется во время игры: когда добавляются или убираются боевое снаряжение или сокровища, рейтинг Нагрузки сразу же изменяется, отражая увеличение или уменьшение тяжести ноши.",
      "пони хоббитов и лошади Лучшее подспорье опытному отряду путешественников — достаточное количество пони или лошадей, которых можно использовать как верховых или вьючных. Количество и качество доступных отряду скакунов зависит от Образа жизни каждого героя (см. таблицу ниже), но все скакуны считаются общим имуществом отряда. Пони — крепкие маленькие животные; они не могут двигаться сильно быстрее обычного шага, особенно если нагружены припасами и снаряжением, но отлично помогают героям справляться с тяготами долгих часов пути. Лошади могут двигаться быстрее («Путешествие», стр. 108), но на Севере таких животных немного, и чаще всего их используют как вьючных или тягловых. Полезность пони и лошадей в путешествиях определяется их рейтингом Тяги. Во время путешествия все герои получают определённое количество баллов Изнурения в пути из-за событий в путешествии. В конце путешествия герои со скакунами уменьшают свой общий рейтинг Изнурения на рейтинг Тяги своего скакуна («Путешествие», стр. 108). Также пони и лошадей можно нагрузить сокровищами, которые нашли герои во время своих приключений («Сокровища», стр. 158). Каждое вьючное животное может нести сокровища, сумма которых не больше 10 баллов Нагрузки. В конце концов он взял только два сундука, один с серебром, а другой с золотом, с весом которых мог справиться один крепкий пони. ПРИМЕРЫ ПОЛЕЗНЫХ ПРЕДМЕТОВ ♦ Нож для свежевания кроликов, маленькая коробочка соли для готовки (ОХОТА). ♦ Моток верёвки с крюком‑кошкой для лазания (АТЛЕТИКА). ♦ Фонарь, защищённый от ветра (ПОИСК); ♦ Диковинный музыкальный инструмент (ВЫСТУПЛЕНИЕ). ♦ Целебная мазь, снимающая боль (ИСЦЕЛЕНИЕ); ♦ Дорогой наряд, жемчужные серьги (ВНУШИТЕЛЬНОСТЬ или УЧТИВОСТЬ). ♦ Крепкий напиток, придающий сил (ВООДУШЕВЛЕНИЕ). ♦ Солнечный камень для ориентирования в непогоду (ИССЛЕДОВАНИЕ). ♦ Изящная трубка, помогающая обрести спокойствие (ПРОНИЦАТЕЛЬНОСТЬ). ♦ Набор подробных карт (СТРАНСТВИЕ). ♦ Набор резчика по камню (РЕМЕСЛО). ПОНИ И ЛОШАДИ ОБРАЗ ЖИЗНИ ТИП И КАЧЕСТВО СКАКУНА ТЯГА Бедный или Скромный Герою не по карману конь или пони — Обычный У героя старый конь или измождённый пони 1 Зажиточный У героя приличный конь или пони 2 Богатый или Очень богатый У героя хороший конь или пони 3"
    ],
    "summary": "Общая Нагрузка героя не может превышать рейтинга Выносливости; учитывается Нагрузка лишь боевого снаряжения и сокровищ. Скакуны — общее имущество отряда; в конце путешествия герой со скакуном снижает Изнурение на рейтинг Тяги, а вьючное животное несёт сокровищ не больше 10 баллов Нагрузки. Тяга скакуна по Образу жизни: Бедный/Скромный — 0, Обычный — 1, Зажиточный — 2, Богатый/Очень богатый — 3.",
    "parameters": {
      "load_cap": "endurance",
      "load_counts": [
        "combat_gear",
        "treasure"
      ],
      "pack_treasure_capacity": 10,
      "fatigue_reduction": "draught_rating",
      "mount_draught_by_standard_of_living": {
        "poor": 0,
        "frugal": 0,
        "common": 1,
        "prosperous": 2,
        "rich": 3,
        "very_rich": 3
      }
    },
    "related": [
      "kv.mechanics.hero_creation.useful_items",
      "kv.mechanics.hero_creation.starting_equipment"
    ]
  }
}
