{
  "schema_version": "1.0",
  "id": "kv.mechanics.checks.which_ability",
  "type": "rule_card",
  "title": "Какая способность проверяется",
  "source": {
    "book": "kv_core",
    "edition": "02_03_2026_с_рубрикатором",
    "section": "Выполнение действий → Выполнение проверок → Какая способность проверяется",
    "pages": [
      17
    ]
  },
  "verified": false,
  "locale": "ru",
  "terminology": "pandora_box",
  "notes": "",
  "payload": {
    "subsystem": "checks",
    "title": "Какая способность проверяется",
    "source_text": [
      "В целом выбор способности зависит от типа проверки. ♦ Проверка навыка. Самый частый тип. Требуется, когда герой игрока пробует сделать что-то, прибегнув к одному из 18 навыков, указанных в бланке героя. ♦ Боевая проверка. В бою в основном используются Боевые умения героев, как при проверках атаки, так и при проверках ЗАЩИТЫ, которые выполняются, чтобы избежать серьёзных травм, когда в героя попали. ♦ Проверки Тени. Соблазну Тени можно противиться с помощью проверок ДОБЛЕСТИ и МУДРО СТИ, чтобы не поддаться Страху, Колдовству и Жадности."
    ],
    "summary": "Три типа проверок: навыка (18 навыков бланка), боевая (Боевые умения: атака и ЗАЩИТА), Тени (ДОБЛЕСТЬ и МУДРОСТЬ против Страха, Колдовства, Жадности).",
    "parameters": {
      "check_types": [
        "skill",
        "combat",
        "shadow"
      ]
    },
    "related": [
      "kv.mechanics.traits.navyki",
      "kv.mechanics.traits.boevye_umeniya",
      "kv.mechanics.valour_wisdom.doblest",
      "kv.mechanics.valour_wisdom.mudrost"
    ]
  }
}
