{
  "schema_version": "1.0",
  "id": "kv.mechanics.hero_creation.patron",
  "type": "rule_card",
  "title": "Покровитель",
  "source": {
    "book": "kv_core",
    "edition": "02_03_2026_с_рубрикатором",
    "section": "искатели приключений → ОТРЯД → Покровитель",
    "pages": [
      52,
      53
    ]
  },
  "verified": false,
  "locale": "ru",
  "terminology": "pandora_box",
  "notes": "Дополнительные преимущества и задачи покровителей даны прозой (в source_text). Полные таблицы заданий покровителей (d6) — в solo-паке (kv.tables.solo); начинание «Встреча с покровителем» — B5 (fellowship_phase, стр. 121).",
  "payload": {
    "subsystem": "hero_creation",
    "title": "Покровитель",
    "source_text": [
      "Отряд может собраться как по воле случая, так и по чьему-то замыслу. Если это не случайность, то встречу героев может организовать кто-то из Мудрых и Великих Средиземья — их покровитель. Покровитель — это влиятельная личность, интересующаяся отрядом и по ходу игры дающая отряду зацепки для новых приключений. Зачастую он оказывает поддержку и помогает советом. Все покровители время от времени взаимодействуют с героями, руководствуясь собственными целями, но в целом стремясь повлиять на события, которые в будущем определят судьбу Средиземья. В начале игры отряд должен выбрать себе одного покровителя из приведённого ниже списка (в дальнейшем по ходу игры у отряда могут появиться и другие покровители). Чтобы выбрать себе одного покровителя, игрокам следует ознакомиться с их характеристиками и выбрать того, чьи интересы и задачи наиболее соответствуют целям отряда. Например, список любимых призваний покровителя станет хорошим ориентиром, чтобы понять, какие задания он может поручить отряду и в чём он может оказаться полезным в ходе игры. Имя выбранного покровителя записывается в журнал отряда. Как можно видеть в таблице ниже, все покровители могут давать бонусы братства, фактически увеличивая количество баллов братства, доступных членам отряда, а также награждать иными особыми преимуществами, обычно связанными с тем, как расходуются баллы братства («Рейтинг братства», стр. 54). Герои могут встретиться с покровителем, если окажутся с ним в одном месте во время Фазы братства и выберут начинание «Встреча с покровителем» (стр. 121). СТАРТОВЫЕ ПОКРОВИТЕЛИ ПОКРОВИТЕЛЬ ЛЮБИМЫЕ ПРИЗВАНИЯ БАЛЛЫ БРАТСТВА ДОПОЛНИТЕЛЬНЫЕ ПРЕИМУЩЕСТВА ЗАДАЧА Балин, сын Фундина командир, воитель +1 Потратьте балл братства, чтобы сделать благополучным бросок при боевой проверке. Вернуть утраченные крепости, устранить командира врага и т.п. Бильбо Торбинс искатель сокровищ, учёный +2 Увеличьте баллы братства на +1, если при начинании «Встреча с покровителем» увиделись с Бильбо. Найти утраченные знания и утерянные реликвии. Гильраэн, дочь Дирхаэля воительница, страж0 Разыграйте сцену путешествия в пределах бывшего королевства Арнор, как если бы это были Пограничные земли. Выберите начинание «Встреча с покровителем», чтобы узнать слух. Сражаться с Врагом, защищать слабых. Гэндальф Серый вестник, командир +2 Потратьте балл братства, чтобы сделать благополучным бросок при проверке Тени. Предупредить вольные народы, вдохновить их на действия. Кирдан Корабел вестник, учёный +1 Потратьте балл братства, чтобы бросить повторно все кости одной проверки. Выберите начинание «Встреча с покровителем», чтобы узнать слух. Возродить надежду, сохранить предания былых эпох. Том Бомбадил и Леди Златеника искатель сокровищ, страж +2 Потратьте все баллы братства, чтобы призвать Тома или Златенику, находясь в любой точке края, где живёт Том. Защищать землю, находить и сохранять то, что было потеряно."
    ],
    "summary": "Покровитель — влиятельная личность, дающая отряду зацепки для приключений и встречающаяся с героями в Фазу братства через начинание «Встреча с покровителем». На старте отряд выбирает одного из шести покровителей; все дают бонус братства и особые преимущества, обычно связанные с тратой баллов братства.",
    "parameters": {
      "patrons": [
        {
          "name_ru": "Балин, сын Фундина",
          "favoured_callings": [
            "captain",
            "warrior"
          ],
          "fellowship_bonus": 1
        },
        {
          "name_ru": "Бильбо Торбинс",
          "favoured_callings": [
            "treasure_hunter",
            "scholar"
          ],
          "fellowship_bonus": 2
        },
        {
          "name_ru": "Гильраэн, дочь Дирхаэля",
          "favoured_callings": [
            "warrior",
            "warden"
          ],
          "fellowship_bonus": 0
        },
        {
          "name_ru": "Гэндальф Серый",
          "favoured_callings": [
            "messenger",
            "captain"
          ],
          "fellowship_bonus": 2
        },
        {
          "name_ru": "Кирдан Корабел",
          "favoured_callings": [
            "messenger",
            "scholar"
          ],
          "fellowship_bonus": 1
        },
        {
          "name_ru": "Том Бомбадил и Леди Златеника",
          "favoured_callings": [
            "treasure_hunter",
            "warden"
          ],
          "fellowship_bonus": 2
        }
      ]
    },
    "related": [
      "kv.mechanics.hero_creation.company",
      "kv.mechanics.hero_creation.fellowship_rating"
    ]
  }
}
