{
  "schema_version": "1.0",
  "id": "kv.mechanics.rewards_virtues.osobennosti",
  "type": "rule_card",
  "title": "Особенности",
  "source": {
    "book": "kv_core",
    "edition": "02_03_2026_с_рубрикатором",
    "section": "доблесть и мудрость → ОСОБЕННОСТИ",
    "pages": [
      80
    ]
  },
  "verified": false,
  "locale": "ru",
  "terminology": "pandora_box",
  "notes": "",
  "payload": {
    "subsystem": "rewards_virtues",
    "title": "Особенности",
    "source_text": [
      "Особенности дополняют арсенал героя из навыков и Боевых умений. Они описывают склонности, присущие герою от природы либо приобретённые со временем и опытом. Гораздо больше, чем просто таланты, они определяют героический облик персонажей игроков. Создавая героя любой культуры, игрок выбирает ему одну Особенность и может выбрать новую за достижение героем каждого нового уровня МУДРОСТИ."
    ],
    "summary": "Особенности дополняют навыки и Боевые умения героя, описывая врождённые или приобретённые склонности и определяя героический облик персонажа. Создавая героя, игрок выбирает одну Особенность и получает новую за каждый новый уровень МУДРОСТИ.",
    "parameters": {
      "choose_at_creation": 1,
      "gain_per": "wisdom_level"
    },
    "related": [
      "kv.mechanics.rewards_virtues.spisok_osobennostey",
      "kv.mechanics.hero_creation.starting_rewards_and_virtues"
    ]
  }
}
