{
  "schema_version": "1.0",
  "id": "kv.mechanics.hero_creation.important_companion",
  "type": "rule_card",
  "title": "Важный товарищ",
  "source": {
    "book": "kv_core",
    "edition": "02_03_2026_с_рубрикатором",
    "section": "искатели приключений → ОТРЯД → Важный товарищ",
    "pages": [
      55
    ]
  },
  "verified": false,
  "locale": "ru",
  "terminology": "pandora_box",
  "notes": "Проверка Тени — стр. 137, B-later (shadow).",
  "payload": {
    "subsystem": "hero_creation",
    "title": "Важный товарищ",
    "source_text": [
      "Рейтинг братства отряда отражает преданность, которую испытывают искатели приключений друг к другу. Однако некоторые из них могут быть связаны с кем-то в отряде более тесными узами. Такая связь может возникнуть из уважения к более мудрому или благородному спутнику, особой дружбы со старым знакомым, родства с соотечественником, глубокой привязанности к члену семьи или даже из жалости к тому, кто кажется слабым или неприспособленным к приключениям. Каждый игрок может выбрать одного члена отряда Важным товарищем для своего героя (это можно сделать и позже, в любой момент игры). Игрок может выбрать Важным товарищем для своего героя любого другого героя в отряде, даже если его уже выбрал кто-то ещё. Такая связь не обязана быть взаимной: героя, которого кто-то выбрал в качестве Важного товарища, можно затем связать совершенно с другим героем. По правилам герои дают серьёзное преимущество, помогая тому, кого выбрали Важным товарищем. Если герой помогает тому, кого выбрал Важным товарищем, тот получает 2к, а не 1к. Однако забота о ком-то имеет и свою цену. Герой получает 1 балл Тени каждый раз, когда тот, кого он выбрал Важным товарищем, получает ранение, впадает в безумие или иным образом серьёзно страдает (получение такого балла Тени нельзя предотвратить проверкой Тени, стр. 137). ПРИМЕР: Как сказано в примере об оказании помощи на стр. 21, хоббит-взломщик получает помощь от своего спутника-бардинга, когда пробует открыть запертую гномью дверь. За эту помощь хоббит получает дополнительную Кость успеха. Если бы бардинг выбрал его Важным товарищем, то хоббит-взломщик получил бы 2к вместо 1к."
    ],
    "summary": "Каждый игрок может выбрать одного члена отряда Важным товарищем (связь не обязана быть взаимной). Помогая Важному товарищу, герой даёт 2к вместо 1к; но за это герой получает 1 балл Тени каждый раз, когда его Важный товарищ получает ранение, впадает в безумие или серьёзно страдает (этот балл нельзя предотвратить проверкой Тени).",
    "parameters": {
      "help_bonus": "2d_success",
      "normal_help_bonus": "1d_success",
      "shadow_cost": 1,
      "shadow_cost_preventable": false,
      "mutual": false
    },
    "related": [
      "kv.mechanics.hero_creation.company",
      "kv.mechanics.hero_creation.fellowship_rating",
      "kv.mechanics.checks.assistance"
    ]
  }
}
