{
  "schema_version": "1.0",
  "id": "kv.mechanics.traits.spisok_otlichitelnyh_kachestv",
  "type": "rule_card",
  "title": "Список Отличительных качеств",
  "source": {
    "book": "kv_core",
    "edition": "02_03_2026_с_рубрикатором",
    "section": "отличия → ОТЛИЧИТЕЛЬНЫЕ КАЧЕСТВА → Список Отличительных качеств",
    "pages": [
      67,
      69
    ]
  },
  "verified": false,
  "locale": "ru",
  "terminology": "pandora_box",
  "notes": "Ключи 24 качеств = ключи, проставленные B2.2 в наборах культур. 6 качеств призваний определены в B2.2 callings (стр. 44). В этот же диапазон попадают сайдбары «Атаки в драке» (правило — в spisok_boevyh_umeniy) и «Изменение качеств» (через йольское начинание, B5).",
  "payload": {
    "subsystem": "traits",
    "title": "Список Отличительных качеств",
    "source_text": [
      "В НРИ «Кольцо Всевластья» представлено 24 Отличительных качества. Ещё 6 доступны только героям определённых призваний и описаны в соответствующей части создания героя (стр. 44). БЛАГОРОДСТВО Ваша благородная манера держаться внушает окружающим почтение и уважение. БЫСТР ОТА Вы двигаетесь быстро и действуете без промедления. АТАКИ В ДРАКЕ Герои, лишившиеся своего верного оружия, порой вынуждены биться голыми руками, полагаться на простой кинжал или даже бросаться камнями. В таких случаях спасти героев может только их боевая подготовка. За героя, атакующего без оружия, кинжалом, дубинкой или импровизированным оружием, бросается количество Костей успеха, равное рейтингу его наибольшего Боевого умения, но со штрафом, убрав 1к. ИЗМЕНЕНИЕ ОТЛИЧИТЕЛЬНЫХ КАЧЕСТВ Игроку, долго играющему одним и тем же искателем приключений, могут со временем наскучить выбранные Отличительные качества, и тогда он может захотеть их изменить. Заменить старое качество новым можно во время Фазы братства в Йоль с помощью начинания «Поведать историю». Выбирая новое Отличительное качество взамен старого, игроку следует проявлять здравомыслие и рассудительность, чтобы не изменить своего героя до неузнаваемости. ГЛАВА 4 68 ВЕРНОСТЬ Вы твёрдо преданы выбранным идеалам или личностям, и непоколебимая верность часто помогает вам в делах. ГОРДОСТЬ Вы высоко цените подвиги и достижения, как собственные, так и своего народа. ЖИЗНЕРАДОСТНОСТЬ Ваш дух нелегко сломить, и вы умеете находить свет даже в самой тёмной из теней. ЗАМКНУТОСТЬ Вы неохотно делитесь своими мыслями и предпочитаете скрывать свои намерения от других, особенно чужаков. ЗАМЕТНОСТЬ Вы выше большинства представителей своего народа. ИСКРЕННОСТЬ Вы чистосердечны, и ваши слова и поступки показывают ваши честные намерения. КРАСОТА Большинство, даже те, кто не принадлежит к вашему народу, считают вас привлекательным. ЛЮБОЗНАТЕЛЬНОСТЬ Ваша природная любознательность легко пробуждается, часто из интереса к тому, что вас не касается, зато вас непросто обмануть внешним видом. НЕСГОВОРЧИВОСТЬ У вас твёрдый характер и сильные убеждения, и вы обычно действуете, опираясь только на собственные суждения. ОБХОДИТЕЛЬНОСТЬ Ваши манеры и речь от природы вежливы и учтивы, а слова редко вызывают недовольство. ОСТРОГЛАЗОСТЬ Ваше зрение острее, чем у большинства окружающих. ОСТРОУМИЕ У вас острый ум, и вы всегда готовы использовать его себе на пользу. ПОДОЗРИТЕЛЬНОСТЬ Вы всегда внимательны к тому, что вас окружает, и следите за словами и поведением незнакомцев. ПРО СТОТА Ваши манеры просты, порой даже грубоваты, но вы знаете: не всякое золото ярко блестит. ПЫЛКОСТЬ Вас охватывают восторг и нетерпение, когда какое-то дело разжигает в вас интерес. СВИРЕПОСТЬ Когда вас провоцируют или когда вы считаете это нужным, вы можете дать волю своей дикой стороне. ОТЛИЧИЯ 69 СМЕЛОСТЬ Вы настолько уверены в своих силах, что вас мало что может напугать, и вы охотно идёте на риск. СУРОВОСТЬ У вас суровый характер, и он проявляется в вашем поведении, жестах и речи. ТЕРПЕЛИВОСТЬ Вы редко теряете самообладание и умеете переносить глупость, задержки или трудности без жалоб и раздражения. УТОНЧЁННОСТЬ Хотя вы и не маг, пути, выбираемые вами для достижения целей, зачастую искусны — если не сказать изощрённы. ЧЕСТНОСТЬ Вы убеждены, что действовать надо честно и согласно морали. ЩЕДРОСТЬ У вас щедрая рука и открытая душа, и вы всегда учитываете нужды других."
    ],
    "summary": "Канонический список 24 общедоступных Отличительных качеств (с описанием каждого) — владелец таксономии качеств движка. Ещё 6 качеств доступны только героям определённых призваний и описаны в создании героя (стр. 44). Реестр 24 ключей с RU-названиями.",
    "parameters": {
      "count": 24,
      "distinctive_features": {
        "noble": {
          "name_ru": "Благородство"
        },
        "swift": {
          "name_ru": "Быстрота"
        },
        "faithful": {
          "name_ru": "Верность"
        },
        "proud": {
          "name_ru": "Гордость"
        },
        "merry": {
          "name_ru": "Жизнерадостность"
        },
        "secretive": {
          "name_ru": "Замкнутость"
        },
        "conspicuous": {
          "name_ru": "Заметность"
        },
        "sincere": {
          "name_ru": "Искренность"
        },
        "fair": {
          "name_ru": "Красота"
        },
        "inquisitive": {
          "name_ru": "Любознательность"
        },
        "stubborn": {
          "name_ru": "Несговорчивость"
        },
        "courteous": {
          "name_ru": "Обходительность"
        },
        "keen_eyed": {
          "name_ru": "Остроглазость"
        },
        "witty": {
          "name_ru": "Остроумие"
        },
        "suspicious": {
          "name_ru": "Подозрительность"
        },
        "simple": {
          "name_ru": "Простота"
        },
        "ardent": {
          "name_ru": "Пылкость"
        },
        "fierce": {
          "name_ru": "Свирепость"
        },
        "bold": {
          "name_ru": "Смелость"
        },
        "grim": {
          "name_ru": "Суровость"
        },
        "patient": {
          "name_ru": "Терпеливость"
        },
        "refined": {
          "name_ru": "Утончённость"
        },
        "honest": {
          "name_ru": "Честность"
        },
        "generous": {
          "name_ru": "Щедрость"
        }
      },
      "calling_only_count": 6,
      "calling_only_keys": [
        "folklore",
        "enemy_lore",
        "shadow_lore",
        "burglary",
        "rhymes_of_lore",
        "leadership"
      ],
      "calling_only_source_pages": [
        44
      ]
    },
    "related": [
      "kv.mechanics.traits.otlichitelnye_kachestva",
      "kv.mechanics.hero_creation.distinctive_features_intro",
      "kv.mechanics.hero_creation.callings"
    ]
  }
}
