{
  "schema_version": "1.0",
  "id": "kv.mechanics.shadow.bezumie",
  "type": "rule_card",
  "title": "Безумие",
  "source": {
    "book": "kv_core",
    "edition": "02_03_2026_с_рубрикатором",
    "section": "Хранитель → ТЕНЬ → Безумие",
    "pages": [
      139,
      140
    ]
  },
  "verified": false,
  "locale": "ru",
  "terminology": "pandora_box",
  "notes": "Владелец приступа безумия. В source_text затекла таблица Проступков (её владелец — shadow.istochniki_teni). Путь Тени определяется призванием — hero_creation.callings; ступени и Изъяны — shadow.ispolzovanie_izyanov.",
  "payload": {
    "subsystem": "shadow",
    "title": "Безумие",
    "source_text": [
      "безумие Как указано на стр. 137, если рейтинг Тени героя достигает максимального рейтинга Надежды, все броски за него становятся злополучными. С этого момента избавиться от баллов Тени можно лишь одним способом — пережив приступ безумия, неистовую реакцию, отмечающую серьёзный шаг на пути к падению. Чтобы разыграть приступ безумия, игрок должен описать, как его герой теряет контроль на короткое время и совершает поступки, о которых потом пожалеет. Описывая потерю контроля, игрок должен учесть источник, из-за которого герой получил последние баллы Тени, что и толкнуло его за грань безумия, Путь Тени героя или один из его Изъянов (см. «Пути Тени» далее). Ниже даны примеры последствий приступа безумия. ♦ ПРЕДАТЕЛЬСТВ О. Герой игрока не держит слово или не выполняет порученное задание, и от этого страдает весь отряд. Например, герой невнимательно следит за пленником, и тот сбегает. ♦ ИСПУГ. Герой поддаётся своим страхам и убегает от любой угрозы, думая только о собственной безопасности. ♦ ВОЖДЕЛЕНИЕ. Герой испытывает непреодолимое желание завладеть чужой вещью и пытается заполучить её тайно или открыто. ♦ ЯРОСТЬ. Герой зацикливается на реальных или мнимых обидах, пока не выплеснет злость на предполагаемый источник угрозы или того, кто ему перечит. Если ничего не подходит к обстоятельствам, обычный приступ безумия может проявиться в виде любой агрессии, словесной или физической, по отношению к наиболее вероятной и доступной цели (часто ей становится Важный товарищ в отряде). Когда приступ безумия проходит, герой быстро обретает самоконтроль. Его разум наконец проясняется, освобождаясь от пелены страхов и сомнений, сгустившихся перед приступом безумия. Герой перестаёт быть злополучным, и в его бланке стирают все метки, отмечающие текущие баллы Тени, но при этом он продвигается на один шаг по своему Пути Тени (стр. 140). Приступ безумия нужно разыграть в текущей Фазе приключений. В противном случае герой игрока, завершивший Фазу приключений с рейтингом Тени, равным его максимальному рейтингу Надежды, считается покинувшим отряд и выбывает из игры. «Что я натворил? Фродо, Фродо! — кричал он. — Вернись! Я обезумел, но всё уже прошло. Вернись!» ПРОСТУПКИ ДЕЙСТВИЕ ПОЛУЧАЕМЫЕ БАЛЛЫ ТЕНИ Жестокие угрозы и злонамеренная ложь; бездумная жестокость 1 Манипуляции; злоупотребление властью; умышленная жестокость 2 Воровство, грабёж; нарушение клятвы, трусость; предательство 3 Пытки и истязания; убийство или калечение сдавшихся или беззащитных 4 Убийство; сознательное служение Врагу 4 и 1 шрам Тени"
    ],
    "summary": "Владелец приступа безумия. Когда рейтинг Тени достигает максимума Надежды, все броски за героя злополучны; единственный выход — пережить приступ безумия. Игрок описывает, как герой теряет контроль (примеры: Предательство, Испуг, Вожделение, Ярость). После приступа герой перестаёт быть злополучным, все метки текущих баллов Тени стираются, но он продвигается на один шаг по своему Пути Тени. Приступ нужно разыграть в текущей Фазе приключений, иначе герой, завершивший её с Тенью, равной максимуму Надежды, считается покинувшим отряд и выбывает из игры.",
    "parameters": {
      "trigger": "shadow == max_hope (all rolls ill-fated)",
      "only_escape_from_overwhelmed": true,
      "types": [
        "betrayal",
        "fright",
        "lust",
        "rage"
      ],
      "after": {
        "no_longer_ill_fated": true,
        "erase_current_shadow_marks": true,
        "advance_one_step_on_shadow_path": true
      },
      "must_roleplay_in_current_adventuring_phase": true,
      "else": "hero_leaves_the_game"
    },
    "related": [
      "kv.mechanics.shadow.bally_teni",
      "kv.mechanics.shadow.ispolzovanie_izyanov",
      "kv.mechanics.hero_creation.callings"
    ]
  }
}
