{
  "schema_version": "1.0",
  "id": "kv.mechanics.hero_creation.calling_scholar",
  "type": "rule_card",
  "title": "Учёный",
  "source": {
    "book": "kv_core",
    "edition": "02_03_2026_с_рубрикатором",
    "section": "искатели приключений → ПРИЗВАНИЯ → Учёный",
    "pages": [
      46
    ]
  },
  "verified": false,
  "locale": "ru",
  "terminology": "pandora_box",
  "notes": "",
  "payload": {
    "subsystem": "hero_creation",
    "title": "Учёный",
    "source_text": [
      "Вслух не секретничайте! Тут знаток древнего языка». Для вас знания — это то, что делает дикий мир менее пугающим. Пожелтевшие карты в забытых книгах отгоняют страх неизведанного, рождая любопытство и восхищение, а песни, сложенные в старину, укрепляют сердце в самые трудные времена. Любовь к учёбе направляет каждый ваш шаг и освещает путь не только вам, но и тем, кто слушает ваши советы. ЛЮБИМЫЕ НАВЫКИ Выберите 2 навыка из следующих: ЗАГАДКИ, ЗНАНИЯ, РЕМЕСЛО — и отметьте как любимые. ДОПОЛНИТЕЛЬНОЕ ОТЛИЧИТЕЛЬНОЕ КАЧЕСТВО: РИФМЫ ЗНАНИЙ Рифмы знаний — это особые краткие стихи и рифмованные фразы, созданные разными народами для запоминания исторических фактов и древней мудрости, которые иначе забылись бы. Учёные говорят, что значительная часть их древних знаний получена именно из таких рифм. ПУТЬ ТЕНИ: ОДЕРЖИМОСТЬ ТАЙНАМИ Любопытство и жажда знаний — достойные качества, но знания можно использовать и во зло, а учёный может начать смотреть на других свысока, сочтя их невеждами. Тайны опасны, ведь желание знать их может поглотить сердце."
    ],
    "summary": "Учёный видит в знаниях способ сделать дикий мир менее пугающим и освещает путь спутникам. Любимые навыки: 2 из ЗАГАДКИ, ЗНАНИЯ, РЕМЕСЛО. Дополнительное качество — Рифмы знаний; Путь Тени — Одержимость тайнами.",
    "parameters": {
      "calling_id": "scholar",
      "favoured_skills": {
        "choose": 2,
        "from": [
          "riddle",
          "lore",
          "craft"
        ]
      },
      "additional_distinctive_feature": "rhymes_of_lore",
      "shadow_path": "secrets"
    },
    "related": [
      "kv.mechanics.hero_creation.callings"
    ]
  }
}
