{
  "schema_version": "1.0",
  "id": "kv.mechanics.reference.game_terms",
  "type": "rule_card",
  "title": "Игровые термины",
  "source": {
    "book": "kv_core",
    "edition": "02_03_2026_с_рубрикатором",
    "section": "Выполнение действий → Игровые термины",
    "pages": [
      24,
      26
    ]
  },
  "verified": false,
  "locale": "ru",
  "terminology": "pandora_box",
  "notes": "Навигационная сводка; OCR-шум слоя (подписи бланка) сохранён дословно по ADR-002 (принятый риск дефектов слоя в прозе).",
  "payload": {
    "subsystem": "reference",
    "title": "Игровые термины",
    "source_text": [
      "Как видно на примере бланка героя, приведённого на этом развороте, в игре используется ряд особых терминов. Ниже даны их определения, чтобы игрокам было легче освоиться. Подробнее о них будет рассказано в следующих Главах. БАЛЛЫ ПРИКЛЮЧЕНИЯ И НАВЫКОВ. В своих походах герои меняются и развиваются, зарабатывая и тратя баллы приключений и навыков, накапливающиеся после каждой игровой сессии. БОЕВОЕ СНАРЯЖЕНИЕ. Оружие, носимое героем, имеющее свои характеристики и рейтинг Нагрузки. БОЕВЫЕ УМЕНИЯ. Отражают мастерство героя в обращении с различным оружием, таким как мечи, топоры, копья и луки. БРАТСТВО. Этот рейтинг обычно соответствует числу героев в отряде. Символизирует узы доверия и взаимопомощи между всеми членами отряда. БРОНЯ. Чтобы избежать серьёзных травм в бою, герои облачаются в броню, включающую несколько слоёв защитного снаряжения, всегда громоздкого и тяжёлого. Вдобавок к прочей экипировке герой может носить шлем. ВЫНОСЛИВОСТЬ. Отражает физическую стойкость и решимость героя. Выносливость уменьшается, когда герой получает физический вред, переносит стресс или истощение. ГРУППЫ НАВЫКОВ. Навыки разбиты на три колонки, в зависимости от характеристики, влияющей на них сильнее других. Есть 6 навыков СИЛЫ, 6 навыков СЕРДЦА и 6 навыков РАЗУМА. ДОБЛЕСТЬ. Рейтинг ДОБЛЕСТИ говорит о статусе героя как вершителя великих дел и о его храбрости перед лицом опасности или врага. Каждый раз при достижении нового уровня ДОБЛЕСТИ герой получает Награду в знак признания его действий. ИЗНУРЕНИЕ. Во время путешествий у героев копятся баллы Изнурения. Изнурение временно повышает максимум Нагрузки, что быстрее приводит к состоянию усталости. ИЗЪЯНЫ. Под влиянием Тени у героя могут развиться Изъяны. Они начинают поддаваться более простым, примитивным эмоциям, меняя уважительное отношение на высокомерие, любовь на похоть, доверие на подозрительность. ИМЯ. Сюда игрок вписывает имя, выбранное герою. Так как у разных народов Средиземья разные традиционные имена, лучше выбрать герою имя из имеющихся в книге типичных примеров, подходящих его культуре. КУЛЬТУРА ГЕРОЯ. Это культурное сообщество, к которому принадлежит герой игрока. Выбор культуры, возможно, важнейшее решение игрока при создании героя. В этой книге имеется 6 культур героев, за персонажей которых можно играть: бардинги, гномы народа Дурина, эльфы Линдона, хоббиты Шира, люди Бри, Следопыты Севера. КУЛЬТУРНЫЙ ДАР. Это особая способность или качество, так глубоко укоренённое в определённом народе, что по правилам любой его представитель им обладает. МУДРОСТЬ. Рейтинг МУДРОСТИ говорит об уровне самосознания и здравомыслии героя. Также это показатель сопротивляемости тлетворному влиянию Тени. Каждый раз при достижении нового уровня МУДРОСТИ герой получает Особенность как следствие своего саморазвития. НАВЫКИ. Навыки – это то, что умеет герой. Игрок записывает рейтинги навыков своего героя, ставя справа от их названия нужное количество отметок в особых полях бланка героя. В ряде случаев при создании героя игроку надо поставить отметку слева от названия навыка, чтобы пометить его как любимый. Любимый навык – это то, в чём герой особо талантлив. НАГРАДЫ. Это боевое снаряжение искусной работы, получаемое героем в качестве приза за подвиги. НаграИМ Культура героя Культурный дар Призвание Внушительность Атлетика Бдительность Охота Выступление Ремесло Топоры Луки Копья Мечи Воодушевление Странствие Проницательность Исцеление Учтивость Сражение Возраст Покровитель Путь Тени Образ жизни сила сердце боевые умения навыки ВЫНОСЛИВОСТЬ НАДЕЖДА ЦЧ ЦЧ РЕЙТИНГ РЕЙТИНГ Сокровища боевое снаряжение Урон Травма Нагрузка Примечания награды ДОБЛЕСТЬ ВЫПОЛНЕНИЕ ДЕЙСТВИЙ да выдаётся, когда герой достигает нового уровня ДОБЛЕСТИ. НАГРУЗКА. Вес, объём и неудобство носимого снаряжения могут ограничивать героя. Если Выносливость героя становится равна его общей Нагрузке или меньше неё, он считается усталым. НАДЕЖДА. Рейтинг Надежды героя определяет запас духовной силы, на который он опирается в моменты опасности. НЕСЧАСТЬЕ. В этом поле бланка игрока ставится отметка, когда герой игрока становится несчастным. Такому герою сложнее совершать любые действия. По правилам, если при броске выпадает знак , действие автоматически считается провальным, даже если общий результат броска равен целевому числу или превышает его. ОБРАЗ ЖИЗНИ. Общее благосостояние культуры, к которой относится герой. Связан с количеством предметов у героя в начале игры. ОСОБЕННОСТИ. Уникальные способности и особые таланты, характерные для определённой культуры. Игрок выбирает своему герою новую Особенность, когда тот достигает нового уровня МУДРОСТИ. ОТЛИЧИТЕЛЬНОЕ КАЧЕСТВО. Уникальные особенности героя, добавляющие деталей в его образ и дающие преимущества при выполнении героем действий, связанных с этими качествами. ПАРИРОВАНИЕ. Этот рейтинг указывает на умение героя игрока отражать удары врага или иначе их избегать. ПРИЗВАНИЕ. Призвания побуждают героев игроков вести жизнь искателей приключений и день ото дня не позволяют им свернуть с этого опасного пути. В игре имеется 6 возможных призваний, отражающих разные мотивы, толкающие персонажей на поиски приключений. Игроки могут выбрать своим героям следующие призвания: вестник, воитель, искатель сокровищ, командир, страж, учёный. Призвания добавляют деталей в образ героя и помогают игрокам выбирать своему герою убеждения и цели, наполняющие его жизнь смыслом. ПУТЬ ТЕНИ. Определяет путь, которым пойдёт герой, если поддастся влиянию Тени. РАНЕНИЕ И ТРАВМА. Герой игрока получает ранение, если атака противника успешно преодолевает его защиту и защитное снаряжение, нанося Травму. РЕЙТИНГИ ХАРАКТЕРИСТИК. Характеристики СИЛА, СЕРДЦЕ и РА ЗУМ описывают физические, духовные и умственные качества героя соответственно. Рейтинги этих характеристик — ключевые составляющие всех героев, отражающие их возможности и природные данные. СОКРОВИЩА. Герои получают сокровища, завладевая материалами и вещами редкой ценности, такими как серебро, золото и самоцветы. Сюда записываются баллы сокровищ, полученные героем игрока. ТЕНЬ. Получение баллов Тени подтачивает запас Надежды героя, ослабляя его дух. Если рейтинг Надежды героя становится равен его текущему рейтингу Тени или ниже него, герой становится несчастным. УСТАЛОСТЬ. В этом поле ставится отметка, когда герой игрока становится усталым. Такой герой выполняет действия со штрафом. ЦЕЛЕВОЕ ЧИСЛО ХАРАКТЕРИСТИКИ. При создании своего героя каждый игрок вычисляет три ЦЧ, используя рейтинги СИЛЫ, СЕРДЦА и РАЗУМА своих героев. Полученные значения записываются в соответствующие поля на бланке героя. ЦЧ используются при большинстве бросков, чтобы учесть характеристики героя. ШРАМЫ ТЕНИ. Герой может закалить свою волю, обменяв имеющиеся баллы Тени на 1 постоянный шрам Тени. ЩИТ. Ношение героем любого щита повышает его рейтинг Парирования."
    ],
    "summary": "Сводный глоссарий бланка героя (~40 терминов: рейтинги характеристик, группы навыков, Выносливость, Надежда, Тень, ЦЧ, состояния, награды и др.); канонические определения раскрыты в профильных карточках. Текстовый слой содержит вкрапления подписей полей бланка между колонками (OCR-артефакт верстки, в т.ч. разрыв определения «Награды») — при вычитке игнорировать.",
    "parameters": {
      "kind": "reference_glossary"
    },
    "related": [
      "kv.mechanics.checks.target_numbers",
      "kv.mechanics.conditions.overview"
    ]
  }
}
