{
  "schema_version": "1.0",
  "id": "kv.mechanics.solo.faza_bratstva_obzor",
  "type": "rule_card",
  "title": "Фаза братства (обзор)",
  "source": {
    "book": "igra_dlya_odnogo",
    "edition": "на_рассылку_03_04_2026",
    "section": "введение",
    "pages": [
      5
    ]
  },
  "verified": false,
  "locale": "ru",
  "terminology": "pandora_box",
  "notes": "Forward-ref: «духовное восстановление героев-одиночек» (стр. 22) — карта блока B-ИдО.3, ещё не создана.",
  "payload": {
    "subsystem": "solo",
    "title": "Фаза братства (обзор)",
    "source_text": [
      "Правила Фазы братства в «Игре для одного» мало отличаются от данных в книге основных правил. Герой-одиночка отдыхает, восстанавливает силы и занимается личными делами — исцеляет шрамы, собирает слухи и беседует с покровителем. Подробности этой фазы даны на стр. 22."
    ],
    "summary": "Соло-Фаза братства почти не отличается от КВ: герой отдыхает, восстанавливает силы и занимается личными делами — лечит шрамы, собирает слухи, беседует с покровителем. Подробности — стр. 22.",
    "parameters": {},
    "related": []
  }
}
