{
  "schema_version": "1.0",
  "id": "kv.mechanics.solo.oko_mordora_solo",
  "type": "rule_card",
  "title": "Око Мордора (соло)",
  "source": {
    "book": "igra_dlya_odnogo",
    "edition": "на_рассылку_03_04_2026",
    "section": "система",
    "pages": [
      15
    ]
  },
  "verified": false,
  "locale": "ru",
  "terminology": "pandora_box",
  "notes": "",
  "payload": {
    "subsystem": "solo",
    "title": "Око Мордора (соло)",
    "source_text": [
      "Одинокий герой привлекает меньше внимания, чем отряд, но может заинтересовать Око Врага. Используйте необязательные правила Бдительности Ока (книга основных правил, стр. 169), чтобы отслеживать заметность вашего героя Врагу и действия тёмных сил Средиземья. Хотя эти правила необязательны в обычной игре, их рекомендуется использовать в одиночной игре, чтобы оживить кампанию и подчеркнуть, что Враг и слуги Тени представляют собой постоянную и коварную угрозу."
    ],
    "summary": "Соло-рекомендация: использовать необязательные правила Бдительности Ока (КВ стр. 169) для отслеживания заметности героя Врагу; в одиночной игре они подчёркивают постоянную угрозу Тени. Структура — в kv.solo.eye_of_mordor.",
    "parameters": {
      "params_ref": "kv.solo.eye_of_mordor"
    },
    "related": [
      "kv.mechanics.eye.oko_mordora"
    ]
  }
}
