{
  "schema_version": "1.0",
  "id": "kv.mechanics.checks.procedure",
  "type": "rule_card",
  "title": "Ход проверки",
  "source": {
    "book": "kv_core",
    "edition": "02_03_2026_с_рубрикатором",
    "section": "Выполнение действий → Выполнение проверок → Ход проверки",
    "pages": [
      17
    ]
  },
  "verified": false,
  "locale": "ru",
  "terminology": "pandora_box",
  "notes": "",
  "payload": {
    "subsystem": "checks",
    "title": "Ход проверки",
    "source_text": [
      "После выбора нужной способности выполняется бросок с учётом рейтинга этой способности (все используемые для броска способности имеют рейтинг от 1 до 6). 1. Бросается 1 Кость испытания и количество Костей успеха, равное рейтингу выбранной способности (если этот рейтинг 0, бросается лишь Кость испытания). 2. Выпавшие на брошенных костях числа складываются, а полученный результат сравнивается с целевым числом (ЦЧ) проверяемой способности. В общем, если сумма броска равна ЦЧ или выше него, проверка успешна; в противном случае — провалена. Успех означает, что действующий герой добился цели, а провал — что что-то пошло не так и он не добился желаемого. Иногда правила точно указывают, что должно произойти при провале или успехе (например, в бою или в путешествии), а в других случаях игрокам и хранителю надо проявить воображение и самим придумать, что случится. В любом случае последствия как успеха, так и провала всегда оказывают явное влияние на ход игры. Подробнее об оценке успешного результата проверки сказано на стр. 18 («Степень успеха»), а о дополнительных правилах последствий провала — в главе 8 «Хранитель»."
    ],
    "summary": "Бросок: 1 Кость испытания + Кости успеха по рейтингу способности (рейтинг 0 — только Кость испытания); сумма сравнивается с ЦЧ; сумма ≥ ЦЧ — успех, иначе провал.",
    "parameters": {
      "feat_dice": 1,
      "success_dice": "ability_rating",
      "ability_rating_range": [
        1,
        6
      ],
      "zero_rating": "feat_die_only",
      "success_condition": "total >= target_number"
    },
    "related": [
      "kv.mechanics.checks.target_numbers",
      "kv.mechanics.checks.degree_of_success"
    ]
  }
}
