{
  "schema_version": "1.0",
  "id": "kv.mechanics.rewards_virtues.osobennosti_elfov",
  "type": "rule_card",
  "title": "Особенности эльфов",
  "source": {
    "book": "kv_core",
    "edition": "02_03_2026_с_рубрикатором",
    "section": "доблесть и мудрость → КУЛЬТУРНЫЕ ОСОБЕННОСТИ → Особенности эльфов",
    "pages": [
      88,
      90
    ]
  },
  "verified": false,
  "locale": "ru",
  "terminology": "pandora_box",
  "notes": "Ключи Культурных особенностей — провизорные движок-идентификаторы (net-new, B3 канонизирует).",
  "payload": {
    "subsystem": "rewards_virtues",
    "title": "Особенности эльфов",
    "source_text": [
      "Для большинства жителей Средиземья эльфы — синоним волшебства. А слово «волшебство» ассоциируется с их грацией, творениями рук эльфов и их неземной красой. БЛЕСК ГНЕВА Народ героя пережил немало поражений и немало бесплодных побед в войнах с Тенью. Смертельная ярость, которую его сородичи питают к Врагу, наполняет оружие героя холодным огнём. ♦ При успешной проверке атаки противник дополнительно теряет 1 балл Ненависти или Решимости, плюс 1 балл за каждый знак успеха . Эльфы атаковали первыми. Их ненависть к гоблинам была холодной и ожесточённой. ПАМЯТЬ ДРЕВНИХ ДНЕЙ Долгие века и бесчисленные поколения людей кажутся эльфам лишь мгновениями. Воспоминания героя уходят во времена, когда Эриадор ещё не был пустынен, и теперь, когда он снова путешествует за пределами своего королевства, знания об этих землях возвращаются к нему. ♦ Если герой является целью сцены путешествия, когда находится в Диких землях, бросок по таблице сцен путешествия выполняется, как если бы герой был в Пограничных землях, а когда он находится в Тёмных землях — как если бы он был в Диких землях. Кроме того, помимо выбранной роли, он всегда может выполнять роль разведчика. «Но Шир не ваш, — сказал Гилдор. — До хоббитов в нём другие жили, и после хоббитов другие будут жить». ПРОТИВ НЕЗРИМОГО Эльфы способны различать существ, обитающих в мире призраков, будь то духи или привидения, даже если они обычно невидимы живым и проявляются лишь как ле ДОБЛЕСТЬ И МУДР О СТЬ 89 денящий шёпот голосов. Герой научился укреплять своё сердце и не поддаваться подобным ужасам. ♦ В проверках Тени при сопротивлении Страху все броски считаются благополучными, и игрок получает1к при любых таких проверках, вызванных злыми духами или призраками (включая и одержимых ими существ). «Я тоже пойду, — сказал Леголас, — я мертвецов не боюсь». СМЕРТОНОСНАЯ СТРЕЛЬБА ИЗ ЛУКА Эльфы от природы метко стреляют из луков. Герой довёл это умение почти до совершенства, и его стрелы находят цель с поразительной точностью. ♦ Когда герой использует лук (не длинный лук) и сражается на Стрелковой позиции, он может попробовать выполнить боевую задачу «Подготовить выстрел» в качестве дополнительного действия. ...маленькие ножи... вряд ли помогли бы против стрел, которыми эльфы в темноте били белке в глаз без промаха. ЭЛБЕРЕТ ГИЛТОНИЭЛЬ! Имя Элберет, Королевы звёзд, почитается всеми эльдар Средиземья. В минуты большой опасности герой не раз взывал к ней, прося Зажигательницу Звёзд даровать ему свою милость. ♦ Максимум Надежды героя увеличивается на 1. В Фазу приключений герой может стать вдохновлённым на количество проверок, равное рейтингу его Мудрости. «Элберет Гилтониэль!» — выдохнул Леголас, взглянув наверх. ЭЛЬФИЙСКИЕ СНОВИДЕНИЯ Дух эльфов настолько силён, что их тела быстро восстанавливаются после самых разных болезней и травм. По мере роста МУДРОСТИ героя он всё меньше и меньше ощущает потребность отлёживаться в постели, чтобы поправиться. Вместо этого он может восстанавливать силы без сна, используя тайные способы своего народа. ♦ Герою не требуется сон, пока он занят простыми, однообразными действиями. Короткий отдых для него считается долгим отдыхом. «...спал он, если это вообще можно было назвать сном с человеческой точки зрения, даже на ходу и с открытыми глазами, погружая свой разум в странные эльфийские грёзы»."
    ],
    "summary": "Шесть Культурных особенностей эльфов: Блеск гнева, Память древних дней, Против незримого, Смертоносная стрельба из лука, Элберет Гилтониэль, Эльфийские сновидения. Реестр ключей с RU-названиями и краткими механическими тегами эффектов.",
    "parameters": {
      "culture_id": "elves_of_lindon",
      "count": 6,
      "cultural_virtues": {
        "gleam_of_wrath": {
          "name_ru": "Блеск гнева",
          "effect": {
            "on_successful_attack": "target_loses_1_hate_or_resolve_plus_1_per_success_icon"
          }
        },
        "memory_of_ancient_days": {
          "name_ru": "Память древних дней",
          "effect": {
            "journey_table_tier_shift": "wild_as_border_dark_as_wild",
            "always_scout_role": true
          }
        },
        "against_the_unseen": {
          "name_ru": "Против незримого",
          "effect": {
            "shadow_check_vs_fear_favoured_and_bonus_1d_vs": "spirits_or_wraiths"
          }
        },
        "deadly_archery": {
          "name_ru": "Смертоносная стрельба из лука",
          "effect": {
            "bow_not_longbow_on_ranged_stance": "ready_shot_as_extra_action"
          }
        },
        "elbereth_gilthoniel": {
          "name_ru": "Элберет Гилтониэль",
          "effect": {
            "hope_max": 1,
            "inspired_checks_per_adventure_phase": "wisdom_rating"
          }
        },
        "elven_dreams": {
          "name_ru": "Эльфийские сновидения",
          "effect": {
            "no_sleep_needed_for_simple_tasks": true,
            "short_rest_counts_as_long_rest": true
          }
        }
      }
    },
    "related": [
      "kv.mechanics.rewards_virtues.kulturnye_osobennosti",
      "kv.mechanics.hero_creation.elves_of_lindon"
    ]
  }
}
