{
  "schema_version": "1.0",
  "id": "kv.mechanics.journey.karta",
  "type": "rule_card",
  "title": "Карта",
  "source": {
    "book": "kv_core",
    "edition": "02_03_2026_с_рубрикатором",
    "section": "Фаза приключений → ПУТЕШЕСТВИЕ → Карта",
    "pages": [
      108,
      109
    ]
  },
  "verified": false,
  "locale": "ru",
  "terminology": "pandora_box",
  "notes": "",
  "payload": {
    "subsystem": "journey",
    "title": "Карта",
    "source_text": [
      "Правила путешествий в НРИ «Кольцо Всевластья» предполагают, что отряд пытается достичь конкретного места назначения. Если отряд должен посетить несколько разных мест, то путь к каждому из них считается отдельным путешествием. Члены путешествующего отряда должны хотя бы примерно представлять, где находится цель их пути, чтобы до неё добраться. Средиземье конца Третьей эпохи — опасное место, а народы, населяющие его, давно отрезаны друг от друга, настолько, что большинство не знает точного положения мест, находящихся всего в нескольких днях пути, а порой даже не догадывается об их существовании. В нижней части журнала путешествий расположена карта игрока с географическими знаниями опытных искателей приключений о местности — которые глубже, чем знания обычных жителей Эриадора. Отряд может выбрать пунктом назначения любой населённый пункт, указанный на карте. Но не все поселения, существующие в Третьей эпохе, указаны на картах — даже в таком малонаселённом регионе, как Эриадор, есть десятки неотмеченных деревень и отдалённых усадеб, оставшихся от бывшего когда-то большим королевства людей. Игроки могут пополнять свои географические знания во время игры, скопировав карту в журнал и нанося на неё посещённые места. ФАЗА ПРИКЛЮЧЕНИЙ 109"
    ],
    "summary": "Правила предполагают, что отряд стремится к конкретному пункту назначения; если целей несколько, путь к каждой — отдельное путешествие. Карта игрока (на форзаце) отражает географические знания; целью может быть любой отмеченный пункт, но не все поселения отмечены. Знания можно пополнять в игре, нанося посещённые места.",
    "parameters": {
      "destination_required": true,
      "multiple_destinations": "separate_journeys",
      "player_map_location": "endpaper"
    },
    "related": [
      "kv.mechanics.journey.puteshestvie",
      "kv.mechanics.journey.poryadok_puteshestviya"
    ]
  }
}
